{
  "type": "aevri.vledger.feedback",
  "version": 1,
  "feedbackId": "01a146c3-bd33-7dd4-9335-0b5417a9f946",
  "profileId": "https://aeilus.institute/vledger/profile.json",
  "elementId": "value-assessment-methodology",
  "phase": "received",
  "gained": [
    "A clear checklist"
  ],
  "lost": [
    "20 minutes"
  ],
  "gap": "below-plan",
  "v": 0.005,
  "anonymous": false,
  "sentAt": "2026-10-17",
  "from": {
    "alg": "Ed25519",
    "x": "NZaxmJZy1D3YyMikLsTaZqY49rJACaW4NIHIPicjS1A"
  },
  "sig": "EbrJYu6WBonlbZQRJTgmFkPeB9cOr8xQeCo1P5yQeMcFVgqyage4zZV6L7b7_SkADCyTm_ftyJezgvnvBwoABQ"
}
